{
  "name": "my-awesome-skill",
  "version": "1.0.0",
  "description": "Clear, concise description of what this package does",
  "author": "Your Name <you@example.com>",
  "license": "MIT",
  "repository": "https://github.com/username/repo",
  "organization": "your-org",
  "format": "claude",
  "subtype": "skill",
  "tags": ["typescript", "best-practices", "code-quality"],
  "files": [
    ".claude/skills/my-awesome-skill/SKILL.md"
  ]
}
